run_id	parent	track	loss	steps_per_sec	loss_gain	speed_gain	grad_ratio	status	reason	description	val_loss
0326	c8494ee012d712c06a8fa254d32fe241dabdeb13	c	0.000000	0.000000	+0.000000	+0.000000	0.000000	crash	the response contained no fenced code block, so there is no patch to apply.	the model returned nothing usable	
0327	bb3470c15c68b391f48f63aa05da4b897ea73927	c	2.379112	45576.254860	-0.016700	+0.914894	1.004978	keep		Replace linear learning-rate decay with cosine decay over the 1000 training steps	2.376884
0328	929ee000ce1803568998abb7aaad1da1ea3917fd	c	0.000000	0.000000	+0.000000	+0.000000	0.000000	crash	the patch did not apply	Use one correctly scaled full-width attention head	
0329	39534cd05d8f2668adcb6550e1a047bf1f083450	c	2.324760	44876.841842	+0.006527	+0.885508	1.004754	discard	no axis improved materially: discarded: loss +0.7%, speed +88.6%; failing learned, loss_material	Add a smoothed trainable previous-token logit prior with sparse Adam updates	2.337668
0330	e5abceeadf1ecf7abd80c333b55cd737e7cdc93d	c	0.000000	0.000000	+0.000000	+0.000000	0.000000	crash	the patch did not apply	Remove redundant gradient zeroing and reuse fused backward and inference activations	
0331	6b1c83a23106b56f5bb197a14b03d2b78f631cc1	c	0.000000	0.000000	+0.000000	+0.000000	0.000000	crash	the model request failed: The read operation timed out	the model returned nothing usable	
0332	7dcf0916aabf68f94ab267e966a094dfc2f02bcc	c	2.381984	60336.524661	-0.017927	+1.535049	1.004978	keep		Update only token and position embeddings used by each document	2.385616
0333	4adcc31bc12166ac2610acb7bedc3e1b72972ac4	c	0.000000	0.000000	+0.000000	+0.000000	0.000000	crash	the response contained no fenced code block, so there is no patch to apply.	the model returned nothing usable	
0334	82aa203937b43a07c720d82a2379558fcbbc1c36	c	0.000000	0.000000	+0.000000	+0.000000	0.000000	crash	the patch did not apply	Halve embedding width to 8 and correct attention scaling	
0335	6e1f91c304afbae60d233d71f209456d63a3d89e	c	0.000000	0.000000	+0.000000	+0.000000	0.000000	crash	the patch did not apply	Halve residual width to 8 and correctly scale four attention heads	
0336	eb21ba30ac3fe2f32f14efcfee939841176226c1	c	2.574614	45794.798704	-0.100246	+0.924076	1.004978	discard	no axis improved materially: discarded: loss -10.0%, speed +92.4%; failing learned, loss_material, loss_tolerance, validation_tolerance	Tie input and output embeddings with one correctly aggregated Adam update	2.558478
0337	a81e630cf78bbed58660b3391608b5f56d7afef7	c	0.000000	0.000000	+0.000000	+0.000000	0.000000	crash	the patch did not apply	Use one full-width attention head and remove redundant gradient clearing and attention reconstruction	
0338	43fe137266334695a799ab0b72c8ad8c9aad3dec	c	0.000000	0.000000	+0.000000	+0.000000	0.000000	crash	the patch did not apply	Accumulate gradients over document pairs and double the cosine peak learning rate	
0339	40b14624c6dc94e2e25b9eb1275316f515b5ce5c	c	2.385896	61410.602939	-0.019599	+1.580177	0.992936	keep		Halve MLP width to 8 and correct its narrower backward projection	2.385190
0340	38d273a741c3b43e7dfef74d32aa44c0673d4103	c	0.000000	0.000000	+0.000000	+0.000000	0.000000	crash	the response contained no fenced code block, so there is no patch to apply.	the model returned nothing usable	
0341	cbb9efa57b6fdae82411c3d1e6af7dbb06054516	c	0.000000	0.000000	+0.000000	+0.000000	0.000000	crash	the patch did not apply	Reduce residual width to 8 and use two correctly scaled 4D heads	
0342	bd18d30e79c3e05faafe615c00bf72bc3b1681c3	c	0.000000	0.000000	+0.000000	+0.000000	0.000000	crash	the patch did not apply	Cache attention outputs during forward instead of reconstructing them during backward	
0343	6feafd3f1f1650248cdd92ed1b69ac8f81c6af26	c	0.000000	0.000000	+0.000000	+0.000000	0.000000	crash	the patch did not apply	Use two wider heads with cached attention and one fewer RMSNorm	
0344	afe850ee9b54a8f88975a3300b52ba29c99bd971	c	2.323168	47571.193475	+0.007208	+0.998712	0.995564	discard	no axis improved materially: discarded: loss +0.7%, speed +99.9%; failing learned, loss_material	Add a centered smoothed training-only bigram log-odds prior to output logits	2.324106
0345	c2e716c8ddca91f2a81433ebf9556cc2f64f9521	c	2.379720	47972.944170	-0.016960	+1.015591	0.992936	keep		Add a 0.001 cosine learning-rate floor for continued optimization near the end	2.383502
0346	e30221b31f12de371010547a7f7d189288b243a0	c	2.406132	58288.220522	-0.028247	+1.448989	0.992936	keep		Raise the cosine learning-rate floor from 0.001 to 0.005	2.395938
0347	65d6c0783076fc1957a588a23d5cdd9d9ea2a7a7	c	0.000000	0.000000	+0.000000	+0.000000	0.000000	crash	the patch did not apply	Use three four-dimensional attention heads	
0348	afa0a02a72eb9c94a92b9a643205d07cdf8577f1	c	0.000000	0.000000	+0.000000	+0.000000	0.000000	crash	the response contained no fenced code block, so there is no patch to apply.	the model returned nothing usable	
0349	71bcb9f191dc0776336ee339a8ca1e66d3e1ebad	c	2.436850	50451.966382	-0.041374	+1.119748	0.992936	keep		Raise cosine learning-rate floor from 0.005 to 0.0075	2.413664
0350	a21d95b779aefeca154cd3a34ecdefb37621013f	c	2.431634	63655.579638	-0.039145	+1.674500	0.998100	keep		Halve MLP width from 8 to 4 for cheaper projections	2.416341
0351	c727117bf3ddbc94812f6e0464b69401d9fc8239	c	0.000000	0.000000	+0.000000	+0.000000	0.000000	crash	the patch did not apply	Use one full-width attention head with the matching scale	
0352	38025bea40bac3881865e6653671be8e294bfca8	c	0.000000	0.000000	+0.000000	+0.000000	0.000000	crash	the patch did not apply	Reduce model width to 10 with two wider heads and support non-multiple-of-four vectors safely	
0353	9267c842a1df1a12daa62c78198c78639bf548bb	c	0.000000	0.000000	+0.000000	+0.000000	0.000000	crash	the response contained no fenced code block, so there is no patch to apply.	the model returned nothing usable	
0354	1c8a10d22c7f15fb22a93e49a482ac7dfe02d195	c	2.377164	59847.839381	-0.015867	+1.514517	0.998100	keep		Lower cosine learning-rate floor from 0.0075 to 0.001	2.383500
0355	b81515fa3b95097395beb45a0449ea9715de654b	c	2.405018	48414.523550	-0.027771	+1.034144	0.994681	keep		Reduce residual width to 8 use two 4D heads widen the MLP to 8 and make vector backpropagation dimension safe	2.405061
0356	23b05474b359fd7f359fb0c1b066933fdac1e79a	c	0.000000	0.000000	+0.000000	+0.000000	0.000000	crash	the patch did not apply	Cache concatenated attention outputs for exact backward-pass reuse	
0357	224846d73066720d0a3e89fa68ff7ae6bec5cab8	c	2.121430	64606.786991	+0.093419	+1.714465	0.993809	discard	no axis improved materially: discarded: loss +9.3%, speed +171.4%; failing learned	Add a training-only smoothed trigram backoff prior to the logits	2.162111
0358	d6537d564897b61d39b0aacffe35556a82b88afc	c	2.404588	61660.359534	-0.027587	+1.590670	0.994620	keep		Merge attention into one full-width 8D head with the matching scale	2.405486
0359	dcbbd85d892279ed267afddce39937068add0390	c	2.588656	66576.788031	-0.106247	+1.797235	0.994620	discard	no axis improved materially: discarded: loss -10.6%, speed +179.7%; failing learned, loss_material, loss_tolerance, validation_tolerance	Tie wte and lm_head by summing their gradients and updating one shared matrix	2.569941
0360	89bc55610e72adbe7fdf2f15788b04a773bf62f1	c	2.405452	85995.916755	-0.027956	+2.613133	0.992553	keep		Halve MLP width from 8 to 4 for a cheaper bottleneck	2.407436
0361	bd1bc0c7df8a294ff5545a22e3be2a38a174f4b2	c	0.000000	0.000000	+0.000000	+0.000000	0.000000	crash	the response contained no fenced code block, so there is no patch to apply.	the model returned nothing usable	
0362	8983078fa55e7a4fd3e586fcc4c750e9b6780336	c	0.000000	0.000000	+0.000000	+0.000000	0.000000	crash	the patch did not apply	Reduce model width from 8 to 4 for fully vector-aligned projections	
0363	75103352476b4a2e987ce58c536559b6f74cdfc0	c	2.415212	89905.152712	-0.032127	+2.777380	0.992553	keep		Let the cosine learning rate decay fully to zero	2.413716
0364	1289453e25aa3c77319762cb2b05a075a453d8eb	c	2.419184	50946.543224	-0.033824	+1.140527	0.988564	keep		Halve the MLP bottleneck from 4 to 2 with a width-safe ReLU loop	2.414933
0365	528a1210cb50cd9e2fd4a5ca0be404c2bc14ff5f	c	0.000000	0.000000	+0.000000	+0.000000	0.000000	crash	the patch did not apply	Fuse square linear backward passes and cache concatenated attention outputs to eliminate duplicate traversals	
0366	c26954619e03e6537b081bde83fbe5fdd874a0bb	c	2.419184	43604.809496	-0.033824	+0.832063	0.988564	keep		Fuse dominant linear weight and input backward passes	2.414933
0367	739b22fabfab03f2ed59a7fbd776a1a969c1d601	c	0.000000	0.000000	+0.000000	+0.000000	0.000000	crash	the patch did not apply	Remove the redundant pre-layer RMSNorm and its backward pass	
0368	6ed196d72628fc5f28f8dae0f8bd8e495e36921b	c	0.000000	0.000000	+0.000000	+0.000000	0.000000	crash	the patch did not apply	Add held-out-safe position-conditioned trigram and bigram logits	
0369	2b3724c933106eefd039e81906968f623f57788d	c	0.000000	0.000000	+0.000000	+0.000000	0.000000	crash	the patch did not apply	Vectorize attention forward and backward passes and reuse cached concatenated attention inputs	
0370	d3f5a543dc94d609888c04f51b3417d4db05449a	c	0.000000	0.000000	+0.000000	+0.000000	0.000000	crash	the patch did not apply	Add a tied previous-token embedding skip to training and inference	
0371	7ef28dd5dd6a88b0ce6c763d0e8e16d3f77eee23	c	2.420088	63915.631557	-0.034211	+1.685426	1.099484	keep		Add a forward and backward tied current-token embedding logit skip	2.409712
0372	1737d635819546610acda08d46d5c843c7a410b0	c	0.000000	0.000000	+0.000000	+0.000000	0.000000	crash	the response contained no fenced code block, so there is no patch to apply.	the model returned nothing usable	
0373	26358e636c848b119772e1bec4dbe4a13c9266a9	c	2.416534	80435.419361	-0.032692	+2.379507	1.099484	keep		Raise the peak learning rate from 0.01 to 0.015	2.404233
0374	26e3de53a94f4f634879274fa74349de46f12f49	c	2.336248	61486.117109	+0.001618	+1.583349	1.007744	discard	no axis improved materially: discarded: loss +0.2%, speed +158.3%; failing learned, loss_material	Add a fixed train-only smoothed bigram log-odds logit prior	2.332155
0375	61b6c7b4517d47571263ec8263a778ea19217606	c	0.000000	0.000000	+0.000000	+0.000000	0.000000	crash	the patch did not apply	Cache and vectorize the causal attention value path	
0376	c4fee85ca7dbf248517e99b65f7abf5461ea1ddb	c	2.412338	60083.212820	-0.030899	+1.524406	1.099484	keep		Raise the peak cosine learning rate from 0.015 to 0.02	2.387714
0377	d4ab5681201f4e8a8d4ec7a65bab9122ec6f4f25	c	0.000000	0.000000	+0.000000	+0.000000	0.000000	crash	the patch did not apply	Cache attention inputs and use forward-only held-out evaluation	
0378	86f4ed346b194912de2d066a2a04fc312d3b9acd	c	0.000000	0.000000	+0.000000	+0.000000	0.000000	crash	the response contained no fenced code block, so there is no patch to apply.	the model returned nothing usable	
0379	7f63f7feb4426eda2f52aed1dbae9ecbc0c0b67f	c	0.000000	0.000000	+0.000000	+0.000000	0.000000	crash	the patch did not apply	Cache attention inputs and streamline softmax with a shifted polynomial exponential	
0380	1519cd34e6c2444012746b8ca5a74311ef0312c5	c	0.000000	0.000000	+0.000000	+0.000000	0.000000	crash	the patch did not apply	Replace softmax libm expf calls with a fast polynomial approximation	
0381	ef6913b6980e87cd28c940a1b925d53750d29791	c	0.000000	0.000000	+0.000000	+0.000000	0.000000	crash	the patch did not apply	Add a sparsely updated trainable bigram logit residual	
0382	50a5c7759e0b6709fc5677faee25a7f5afb95b18	c	0.000000	0.000000	+0.000000	+0.000000	0.000000	crash	the patch did not apply	Split attention into two four-dimensional heads	
0383	dcfee8c73607c934c314c6789ea8672c6f05a948	c	2.407736	108631.701620	-0.028932	+3.564179	1.108624	keep		Widen the one-layer MLP from two to three hidden units	2.388505
0384	dec6258da8f2f214b3147598da769eb304c213f5	c	2.415854	51874.282787	-0.032401	+1.179507	1.104990	keep		Widen the one-layer MLP from three to four hidden units	2.390583
0385	74b14d36721965670ab59082365947824d6fa1af	c	2.407736	63457.816542	-0.028932	+1.666191	1.108624	keep		Reduce the one-layer MLP width from four hidden units to three	2.388505
0386	0b426bae6990a2295ec780f7eceb410b54c15159	c	0.000000	0.000000	+0.000000	+0.000000	0.000000	crash	the response contained no fenced code block, so there is no patch to apply.	the model returned nothing usable	
0387	c091123c5f7c80e74b0bf6ada5fe8caa751dc771	c	0.000000	0.000000	+0.000000	+0.000000	0.000000	crash	the patch did not apply	Restrict attention to the current token value path	
0388	b451ec44333426edfdac843973bb6bb8556d2fcc	c	0.000000	0.000000	+0.000000	+0.000000	0.000000	crash	the patch did not apply	Add a smoothed train-only positional log-prior residual	
0389	6f9c62ae36f1620ad4fb831a0147d6ee40f19b7f	c	0.000000	0.000000	+0.000000	+0.000000	0.000000	crash	the patch did not apply	Cache attention inputs for exact reuse during backward	
0390	098af8cf24a57635be3b6cf602193d1d7b569b6f	c	0.000000	0.000000	+0.000000	+0.000000	0.000000	crash	the patch did not apply	Vectorize softmax exponentials with accurate binary range reduction	
0391	aed16388487257b8d431ac43b7c736f9f244f736	c	2.609602	83836.942055	-0.115198	+2.522423	1.147200	discard	no axis improved materially: discarded: loss -11.5%, speed +252.2%; failing loss_material, loss_tolerance, validation_tolerance	Add a frozen smoothed training-only bigram log-prior residual to the logits	2.618325
0392	7e721a672b070b00118ddca09c7a9286bd9f4d23	c	0.000000	0.000000	+0.000000	+0.000000	0.000000	crash	the gradient check did not pass	Replace softmax expf with a degree-eight range-reduced exponential polynomial	
0393	83cec936d90867df5e19804a585438de6806e87f	c	2.407736	54755.015920	-0.028932	+1.300541	1.108624	keep		Skip post-training sampling and use forward-only direct-logit validation	
0394	72eaef73d29585a04ecda8248926fdb16251106c	c	2.407734	54196.990715	-0.028931	+1.277096	1.108515	keep		Use bounded polynomial softmax exponentiation and rely on Adam to clear gradients between steps	
0395	764bec634cdffb7c2a52043a46049f891f2892b3	c	0.000000	0.000000	+0.000000	+0.000000	0.000000	crash	the response contained no fenced code block, so there is no patch to apply.	the model returned nothing usable	
0396	1991859e2870170dcbe78dc339972e831e9d9582	c	0.000000	0.000000	+0.000000	+0.000000	0.000000	crash	the response contained no fenced code block, so there is no patch to apply.	the model returned nothing usable	
0397	73f481950f4f0b514ed0f8526e9f43263477c374	c	0.000000	0.000000	+0.000000	+0.000000	0.000000	crash	the response contained no fenced code block, so there is no patch to apply.	the model returned nothing usable	
0398	1b48fd8b9b0cc396aaf6cca343ae597cee006cd1	c	0.000000	0.000000	+0.000000	+0.000000	0.000000	crash	the response contained no fenced code block, so there is no patch to apply.	the model returned nothing usable	
0399	f0908eed035b5cb1cc79ab83682db1afd802bdd7	c	0.000000	0.000000	+0.000000	+0.000000	0.000000	crash	the patch did not apply	Use fixed adjacent-token average attention and remove Q K projection work	
0400	0f7f86aa061107b05cb5023882c661e6dd307ee2	c	0.000000	0.000000	+0.000000	+0.000000	0.000000	crash	the response contained no fenced code block, so there is no patch to apply.	the model returned nothing usable	
0401	47ddc572007b9cca49404d6dece0d540e4eaa2d5	c	2.413252	48420.384219	-0.031289	+1.034390	1.111036	keep		Direct normalized-state attention removes Q and K projection work while retaining softmax selectivity	
0402	8596e276a2252cd3d8d9f2b6226e2d35d3a292da	c	0.000000	0.000000	+0.000000	+0.000000	0.000000	crash	the response contained no fenced code block, so there is no patch to apply.	the model returned nothing usable	
0403	0cc5cca0b4dda259abd1e662e168ce64c7bec456	c	0.000000	0.000000	+0.000000	+0.000000	0.000000	crash	the patch did not apply	Learn a global direct-attention logit scale initialized to 1.0	
0404	08bd78d2082292d6b451808389e0921ff3909edc	c	2.412004	48623.942379	-0.030756	+1.042943	1.108498	keep		Widen the sole MLP bottleneck from three units to four	
0405	a2bbf8e49ef883caffa49619e763b44cc6dbbafc	c	0.000000	0.000000	+0.000000	+0.000000	0.000000	crash	the patch did not apply	Remove the redundant pre-layer RMSNorm before the sole block	
0406	e16de604227b4d85a6da816c784c92603703d754	c	2.414098	79044.616535	-0.031651	+2.321073	1.100834	keep		Correct query and key gradients in direct normalized-state attention	
0407	b3cf442c58466bc8ecee819410fe46d0fdb7b907	c	0.000000	0.000000	+0.000000	+0.000000	0.000000	crash	the patch did not apply	Cache direct-attention outputs for backward and skip dead Q and K Adam updates	
0408	a1bb5ffa8224ad661cd3bcddb97590dac89aac05	c	0.000000	0.000000	+0.000000	+0.000000	0.000000	crash	the patch did not apply	Cache attention outputs and remove redundant backward and Adam work	
0409	0546c68cb60250fa84a0ee76e4c44c97f8c46873	c	2.412688	63579.694253	-0.031048	+1.671311	1.102242	keep		Use unit scaling for direct normalized-state attention logits	
0410	7da6b66051d7901c41d39d516b27d27011eeff2f	c	0.000000	0.000000	+0.000000	+0.000000	0.000000	crash	the patch did not apply	Cache direct-attention states and remove redundant normalization optimizer and backward work	
0411	2cdde96140358925f26ba9caa4604e9e4f852695	c	0.000000	0.000000	+0.000000	+0.000000	0.000000	crash	the patch did not apply	Sharpen direct attention to 2x and remove duplicate normalization dead Q/K updates and attention recomputation	
0412	917496fc107598b0dac3c9ccf1d4a6c44208f3a0	c	2.412688	74314.682703	-0.031048	+2.122344	1.102242	keep		Skip Adam updates for unused direct-attention query and key matrices	
0413	9c17d24f45770206e116ae961b94b1e2ff1c09bd	c	0.000000	0.000000	+0.000000	+0.000000	0.000000	crash	the patch did not apply	Add a fixed bigram log-odds prior to output logits	
0414	108ed534e6beb1bc9a19f38c66d5ec268acc6a3e	c	2.413162	75467.659621	-0.031251	+2.170786	1.102429	keep		Isolate 2x direct-attention score sharpening	
0415	cd3f69e693abd6a3ffe736db612eb88dbd9d43e1	c	2.413162	59970.615515	-0.031251	+1.519675	1.102429	keep		Cache direct-attention outputs to eliminate redundant backward reconstruction	
0416	ff7cf9a38b9cc31fa587fa84acbc8c0da9c8722f	c	2.380148	80583.157376	-0.017142	+2.385715	1.034535	discard	no axis improved materially: discarded: loss -1.7%, speed +238.6%; failing learned, loss_material, validation_reported	Add a half-strength smoothed bigram backoff logit prior	
0417	55d5cdec20bd0d766d1b5e45bbe1c9fc5d2eee2a	c	0.000000	0.000000	+0.000000	+0.000000	0.000000	crash	the patch did not apply	Apply the value projection after mixing direct-attention states	
0418	477d5abaa092395e7ee26ec054de52504ce60873	c	0.000000	0.000000	+0.000000	+0.000000	0.000000	crash	the gradient check did not pass	Remove the redundant input RMSNorm and propagate gradients directly to the embeddings	
0419	ff0dea03ddf484e58e49906c7e48613dccc5857b	c	0.000000	0.000000	+0.000000	+0.000000	0.000000	crash	the patch did not apply	Replace data-dependent direct attention with a uniform causal mean	
