run_id	parent	track	loss	steps_per_sec	loss_gain	speed_gain	grad_ratio	status	reason	description	val_loss
0114	b1f78065405f008e36586f3ebaceeddb40661452	go	2.407210	437.980437	-0.002512	+7.630066	1.127378	keep		Fuse final softmax cross entropy into one tape node	
0115	7f9312905abd7956a2eec52eeeeee15f15ee5e6e	go	2.380292	363.537410	+0.008698	+6.163224	0.999989	keep		Differentiate the shared RMSNorm scale and add a second transformer block to lower loss	
0116	79817d1e2619b595be44d11fe54e1a964b8e8927	go	2.387866	407.434076	+0.005544	+7.028174	0.999989	keep		Remove the second transformer block for a large speedup with minimal additional loss	
0117	cbd0814fd3b815dc392dd57280616c9d82f5c69d	go	0.000000	0.000000	+0.000000	+0.000000	0.000000	crash	the patch did not apply	Fuse attention scaling and weighted value reduction into analytic tape nodes	
0118	444ab6cd42e38931b77965f16a2695b7c8cb8b2f	go	2.387866	472.005093	+0.005544	+8.300496	0.999989	keep		Fold attention scaling into dot products to remove scalar tape nodes	
0119	71a98c129a5a02da88ee0d2595a78cdfdd7b2abb	go	2.392314	39.366665	+0.003692	-0.224310	0.999989	discard	no axis improved materially: discarded: loss +0.4%, speed -22.4%; failing loss_material, speed_material, speed_tolerance	Restore beta2 0.99 and deepen the residual stack to four blocks	
0120	382ab2c79e76669e978212897bc43dbe9744cadd	go	2.274310	53.963503	+0.052836	+0.063309	0.999989	keep		Train on four-document minibatches to reduce gradient variance and improve final loss	
0121	486fdebb6fa4c197d986d60f6ba935c1fa31d02d	go	2.274310	106.198455	+0.052836	+1.092559	0.999989	keep		Parallelize the four per-document forward graphs to raise training throughput without changing the loss	
0122	e2f5f5db0c27344fd40139282757fc6d4c0dd72a	go	2.269484	65.846080	+0.054846	+0.297446	0.999989	keep		Increase the training minibatch from four documents to eight	
0123	c600c3bc46fd5519bc72b5f5724e8bbaf702fbd0	go	2.269484	61.137386	+0.054846	+0.204665	0.999989	keep		Fuse residual additions into projection nodes to reduce tape and allocation overhead	
0124	dced13289fc381c42fb1f13ee1740f0b253b4e2c	go	2.274310	47.719359	+0.052836	-0.059727	0.999989	discard	no axis improved materially: discarded: loss +5.3%, speed -6.0%; failing speed_material, speed_tolerance	Reduce the training minibatch from eight documents to four	
0125	517c9f025ab1f82bf079ccb046120666cc749b39	go	0.000000	0.000000	+0.000000	+0.000000	0.000000	crash	go build failed	Batch fused projection and softmax tape operands into disjoint fixed-capacity backing arrays	
0126	f75b786c2c8cc85548a5867861550bc180d711fb	go	2.261960	62.177145	+0.057979	+0.225153	0.999989	keep		Use two attention heads of width eight instead of four heads of width four	
0127	bf6960d8ce5f82212f5cbce95b7a6b2dc7f9e5fe	go	0.000000	0.000000	+0.000000	+0.000000	0.000000	crash	the patch did not apply	Replace fused ReLU MLP projections with exact GELU while preserving the analytic tape node	
0128	99f2a7aefd7ea6f191c88248ce5fc270383a711f	go	2.275756	33.501453	+0.052234	-0.339880	1.000610	discard	no axis improved materially: discarded: loss +5.2%, speed -34.0%; failing speed_material, speed_tolerance	Replace explicit attention softmax and weighted sums with exact direct Jacobian nodes	
0129	93fb701408f6736730c84d9be5b4b0a2dfb57998	go	2.261924	77.417810	+0.057994	+0.525458	0.999989	keep		Use one full-width attention head instead of two half-width heads	
0130	0c82f554189465c852701542c6a764085af95c86	go	2.261924	37.057786	+0.057994	-0.269805	0.999989	discard	no axis improved materially: discarded: loss +5.8%, speed -27.0%; failing speed_material, speed_tolerance	Raise the Go garbage-collection target to 800 percent to reduce collection overhead without changing the loss	
0131	cf295643c5d02abb442d8bd56c4f0479507e95e6	go	0.000000	0.000000	+0.000000	+0.000000	0.000000	crash	the patch did not apply	Reuse backward topological scratch and merge slice restoration into the reverse pass	
0132	c87d584e7a248992ae0582ee1cd0e5f3bd20ad18	go	0.000000	0.000000	+0.000000	+0.000000	0.000000	crash	the patch did not apply	Fuse RMS scaling into projection nodes to remove normalization multiply nodes	
0133	8f5d024a7d5246dda731fc2631f76d9af1cec911	go	0.000000	0.000000	+0.000000	+0.000000	0.000000	crash	the gradient check did not pass	Collapse mean and batch softmax tape allocations to reduce Go overhead	
0134	a5b6e483ba2078717831e28bff4ef9af8b3bd8f5	go	0.000000	0.000000	+0.000000	+0.000000	0.000000	crash	the gradient check did not pass	Batch linear projection tape operands into disjoint backing arrays	
0135	a4c950026597e8e5a63b7a2ca673b0db076d32dd	go	0.000000	0.000000	+0.000000	+0.000000	0.000000	crash	the model request failed: The read operation timed out	the model returned nothing usable	
0136	4349006c62b4048572897a0fa6a108e1d747d233	go	0.000000	0.000000	+0.000000	+0.000000	0.000000	crash	the patch did not apply	Batch projection tape operands into bounded backing arrays	
0137	f8e53a53dca608ea2ea358aae2136a6363245ec3	go	0.000000	0.000000	+0.000000	+0.000000	0.000000	crash	the patch did not apply	Fuse vocabulary projection and cross entropy into one tape node	
0138	d7c7a349b4ecc910acd8cb47a1849109e54d51ca	go	0.000000	0.000000	+0.000000	+0.000000	0.000000	crash	the response contained no fenced code block, so there is no patch to apply.	the model returned nothing usable	
0139	eb187dedc5c8b29bf6928bab3c01f41f3b92e4e3	go	2.264124	130.000803	+0.057078	+1.561565	0.999989	keep		Reuse the initial RMSNorm in the first layer instead of normalizing it again	
0140	0597c391dfb1a51ac182b9dcfb5da23609900002	go	2.267710	140.651305	+0.055584	+1.771425	0.999992	keep		Halve MLP hidden width from 4x to 2x embedding width	
0141	a675a53aaeaa8444b6e0d2972621e5f265ff39db	go	2.290196	218.041237	+0.046220	+3.296334	0.999992	keep		Narrow embedding attention and output widths from 16 to 12	
0142	62faab71671a1703763388528f2808075fe9947b	go	0.000000	0.000000	+0.000000	+0.000000	0.000000	crash	the patch did not apply	Replace per-row children and local-gradient slices with compact two-operand tape nodes	
0143	9af9d4014fb294eb58a902dc07928a63a912b47c	go	2.301260	265.781181	+0.041612	+4.237013	0.999982	keep		Halve the MLP hidden width from 2x to 1x embedding width	
0144	cbd3183021dcd9b0733eb8a4c68f4ef19f95712f	go	2.301022	220.008241	+0.041711	+3.335092	0.999982	keep		Narrow the embedding attention output and 1x MLP widths from 12 to 10	
0145	6732532ef1673166309f543efea1ebec39eda057	go	0.000000	0.000000	+0.000000	+0.000000	0.000000	crash	training run failed (exit 2)	Rebalance to embedding width 8 with a 2x-wide MLP to reduce projection work	
0146	ef0f9fef7ba1bca41aa0b9f3e1a1d0ac5da7d995	go	2.292828	197.605878	+0.045124	+2.893671	0.999982	keep		Add a second width-10 transformer layer	
0147	b41887b921a4f7c51bdf54024143955138c32fc8	go	0.000000	0.000000	+0.000000	+0.000000	0.000000	crash	the gradient check did not pass	Add zero-initialized biases to every trainable projection	
0148	ee6a09ad36a15fc8464e8ea75730c9575622ab19	go	0.000000	0.000000	+0.000000	+0.000000	0.000000	crash	the gradient check did not pass	Restore the 16-wide four-head 4x-MLP configuration behind the best observed loss	
0149	23c5603ac27bbe88a938adb246cb5794343f6fe2	go	2.292828	240.379945	+0.045124	+3.736501	0.999982	keep		Share tape backing arrays across projection rows to reduce allocations	
0150	e26ae807aef1d87c585739aa3377da23c04ae9e7	go	0.000000	0.000000	+0.000000	+0.000000	0.000000	crash	the gradient check did not pass	Add a zero-initialized vocabulary logit bias to learn token marginals directly	
0151	f29bb2dc15c44c1ac1f5cc21206a7ee47a65d2ed	go	2.292828	253.224612	+0.045124	+3.989595	0.999982	keep		Batch RMSNorm and softmax tape operands into bounded backing arrays	
0152	373d52da75195e4060e27e341d0fd85262eeacff	go	2.362714	222.967827	+0.016019	+3.393409	0.999946	keep		Tie token embeddings to the vocabulary projection while preserving the initialization draw sequence	
0153	ee9cba73412fe9ab21cab8967ebbdff133342680	go	2.292828	246.903115	+0.045124	+3.865035	0.999982	keep		Restore the independent vocabulary projection matrix	
0154	00f7336970586dc293816692a2ae031936fe333a	go	0.000000	0.000000	+0.000000	+0.000000	0.000000	crash	the gradient check did not pass	Scale the two-layer model to 16-wide four-head attention with a 2x MLP	
0155	e2032df4b828990ee1826cb03fd654ee604ce357	go	2.301022	398.825048	+0.041711	+6.858540	0.999982	keep		Remove the second transformer layer to gain speed with negligible loss regression	
0156	5d2b84e8ac9f8cd8b0e978e4ff968d29e84940a1	go	2.301022	391.652936	+0.041711	+6.717219	0.999982	keep		Collapse the mean tape into one node to remove 127 add nodes and their allocations per step	
0157	41d95f6014a5410fd83e5983da4dd7419d5bce87	go	2.301022	373.030800	+0.041711	+6.350284	0.999984	keep		Fuse attention mixing and vocabulary cross-entropy to cut tape nodes and allocations	
0158	d39609621b7368bf6034d6f98d1f807d796f7078	go	0.000000	0.000000	+0.000000	+0.000000	0.000000	crash	the patch did not apply	Batch hot-path Value records in contiguous arrays to reduce allocation and GC overhead	
0159	47153c0c39cccbd7628e442daf0c8d9e86f63642	go	2.258892	148.488500	+0.059257	+1.925851	0.999990	keep		Restore the 16-wide four-head one-layer 4x-MLP model with correctly shaped matrices	
0160	69db35be22f1981cf40f8174a61903bd6bc7a92f	go	0.000000	0.000000	+0.000000	+0.000000	0.000000	crash	the patch did not apply	Use a 0.01 leaky-ReLU MLP activation to preserve gradients for negative preactivations	
0161	da34eff47c965a845df1836a4c76bd2d2d3b42c4	go	2.258892	141.149660	+0.059257	+1.781245	0.999990	keep		Fuse token and position addition into first RMSNorm	
0162	4e0962e3df63fdf89b0555aecfcf569235a49ae4	go	0.000000	0.000000	+0.000000	+0.000000	0.000000	crash	the patch did not apply	Batch projection and attention output Values in contiguous arrays to reduce allocation and GC overhead	
0163	d28c6fcbac0d5aec5bcc7a91547600494f1e2ab6	go	2.284156	221.047812	+0.048735	+3.355576	0.999990	keep		Narrow the one-layer model to 12 dimensions with four 3-dimensional attention heads	
0164	b9bbce94ae0f988071f95ba3214ad2ff17c2babc	go	0.000000	0.000000	+0.000000	+0.000000	0.000000	crash	the patch did not apply	Use a 0.01 leaky ReLU in the fused MLP projection to retain negative-side gradients at negligible cost	
0165	b02263182311345b9df34c2585edaf4bf9c24f67	go	2.239856	81.572534	+0.067185	+0.607324	0.999990	keep		Widen the one-layer model to 24 dimensions with four 6-dimensional heads	
0166	b2dca219997b5397a459101a38fa6c6085a96a64	go	2.234642	106.088639	+0.069356	+1.090395	0.999993	keep		Halve the MLP width to reduce dominant projection work	
0167	522e3beb804a09200b39ec0bbb6ba2c40ca1dd76	go	0.000000	0.000000	+0.000000	+0.000000	0.000000	crash	the patch did not apply	Raise the Go garbage-collection target to reduce autograd tape collection overhead	
0168	9771ae257cafe3e912209182b1b482a18e57d21d	go	2.230962	60.288232	+0.070889	+0.187933	0.999993	keep		Widen the one-layer model to 32 dimensions with four 8-dimensional attention heads	
0169	6e1beb5b0d7af51cb554d34b8350482a0554f1f6	go	2.230962	66.188536	+0.070889	+0.304194	0.999993	keep		Right-size the autograd topology buffer to reduce per-step GC pressure	
0170	b509272993c012e8469dcc0b86ca2f037eae7574	go	2.224834	52.943912	+0.073441	+0.043219	0.999984	keep		Halve the one-layer MLP width from 64 to 32	
0171	224a57b4709116ffc1f5d77f35e2cbd302d9b68d	typescript	0.000000	0.000000	+0.000000	+0.000000	0.000000	crash	the patch did not apply	Faster exact tape traversal with generation marks lean scalar nodes and hoisted softmax inverse math	
0172	3ff8f3b5a4b6bb2cc250f63df54b95e474fb3933	typescript	0.000000	0.000000	+0.000000	+0.000000	0.000000	crash	the response contained no fenced code block, so there is no patch to apply.	the model returned nothing usable	
0173	2b83f4329e900168b5ada719dd5698b869ffe2b0	typescript	0.000000	0.000000	+0.000000	+0.000000	0.000000	crash	tsc --noEmit failed	Differentiate the shared RMSNorm scale node on the autograd tape	
0174	d52aa76a730fe9fea3dc011b31c9c739c6e75bf9	typescript	0.000000	0.000000	+0.000000	+0.000000	0.000000	crash	tsc --noEmit failed	Compact exact RMSNorm backward without tape expansion	
0175	e657dd3a904d49114c7713960d8269b4f48e5917	typescript	0.000000	0.000000	+0.000000	+0.000000	0.000000	crash	tsc --noEmit failed	Fuse linear dot products into one tape node with direct product-rule gradients	
0176	7ea330c0c75a170d13963e423afa2e1d7c18682a	typescript	0.000000	0.000000	+0.000000	+0.000000	0.000000	crash	the patch did not apply	Exact tape compaction and hoisted Adam bias correction	
0177	444c85f77b128db24c8ffb0c6dc884a8ae6e5ce7	typescript	0.000000	0.000000	+0.000000	+0.000000	0.000000	crash	the patch did not apply	Collapse constant operands and zero seeds in hot autograd accumulators	
0178	5533b5eb6130567a2174965e2da1fed96120da64	typescript	0.000000	0.000000	+0.000000	+0.000000	0.000000	crash	the response contained no fenced code block, so there is no patch to apply.	the model returned nothing usable	
0179	db18e40d326e5bb07cf9078609da080f043d3880	typescript	0.000000	0.000000	+0.000000	+0.000000	0.000000	crash	tsc --noEmit failed	Restore differentiable RMSNorm through a shared scale node	
0180	c4e52f491ffa5899e3b85cbcf234d11b93581efd	typescript	0.000000	0.000000	+0.000000	+0.000000	0.000000	crash	tsc --noEmit failed	Fuse linear dot products into exact product-rule tape nodes	
0181	b50c696e0452fc0bd422abc50fb2c20bb9ccedd0	typescript	0.000000	0.000000	+0.000000	+0.000000	0.000000	crash	the patch did not apply	Fused exact multiply-add graph nodes and unary scalar nodes for a large speed gain	
0182	c842776cc5a0bf6ab54c1f044b8192be75f011ea	typescript	0.000000	0.000000	+0.000000	+0.000000	0.000000	crash	tsc --noEmit failed	Shared differentiable RMSNorm scale with exact local derivatives	
0183	9e5e26952305907a0ec4e2fd0399322bcf7d2daf	typescript	0.000000	0.000000	+0.000000	+0.000000	0.000000	crash	the response contained no fenced code block, so there is no patch to apply.	the model returned nothing usable	
0184	f64720b376342763c624fc26f48785c0dfb27e5b	typescript	0.000000	0.000000	+0.000000	+0.000000	0.000000	crash	the patch did not apply	Use direct scalar nodes and fan-in sums to shrink the exact autograd tape	
0185	c2d86deb442299a0e704fcf7df1bf3b269ac3d73	typescript	0.000000	0.000000	+0.000000	+0.000000	0.000000	crash	tsc --noEmit failed	Construct differentiable RMSNorm with existing Value primitives and no custom nodes	
0186	4f5da770a90b9dda6c5a614c7364a7352b8cf0fe	typescript	0.000000	0.000000	+0.000000	+0.000000	0.000000	crash	tsc --noEmit failed	Fuse linear-layer sums into exact n-ary autograd nodes	
0187	b5a93cd90f7db11dfc9c146be3e229ac49e916e5	typescript	0.000000	0.000000	+0.000000	+0.000000	0.000000	crash	tsc --noEmit failed	Fuse only the RMSNorm mean-square onto the tape with its exact 2x/n local derivative	
0188	c1f0f1aaad04288e43274ce1b2ff7ec2ed158a91	typescript	0.000000	0.000000	+0.000000	+0.000000	0.000000	crash	the patch did not apply	Fuse hot dot products and reductions into exact nary autograd sums	
0189	c3a28c948ee0bcd2e4a959b1980ce0f02a460727	typescript	0.000000	0.000000	+0.000000	+0.000000	0.000000	crash	tsc --noEmit failed	Added reference AdamW decoupled weight decay with betaW 0.1	
0190	45c8e21833fd326c6d8dfa00b6ff0b799adda419	typescript	0.000000	0.000000	+0.000000	+0.000000	0.000000	crash	tsc --noEmit failed	Make RMSNorm differentiable with exact square mean scale gradients	
0191	c1205f772e58d491a70180b0c030cb061959e540	typescript	0.000000	0.000000	+0.000000	+0.000000	0.000000	crash	tsc --noEmit failed	Fuse sums into exact n-ary autograd nodes	
0192	43a5ff60a28c28775b74c3c881f1642531025a0b	typescript	0.000000	0.000000	+0.000000	+0.000000	0.000000	crash	the response contained no fenced code block, so there is no patch to apply.	the model returned nothing usable	
0193	8e8ed952a163247ebf16b9861454c45c72ad9183	typescript	0.000000	0.000000	+0.000000	+0.000000	0.000000	crash	the response contained no fenced code block, so there is no patch to apply.	the model returned nothing usable	
0194	d49698fb2702c11c3faaadd478957fe3f4c2872e	typescript	0.000000	0.000000	+0.000000	+0.000000	0.000000	crash	the response contained no fenced code block, so there is no patch to apply.	the model returned nothing usable	
0195	e51684ab89ba1294797f9a2250e5cceed52851c6	typescript	0.000000	0.000000	+0.000000	+0.000000	0.000000	crash	tsc --noEmit failed	Lower Adam beta2 from 0.99 to 0.98 for faster late-run gradient adaptation	
0196	0e50da92910db29f1b7e140f27ad69bfda6d1661	typescript	0.000000	0.000000	+0.000000	+0.000000	0.000000	crash	tsc --noEmit failed	Fuse hot accumulations into copied-child n-ary sum nodes	
0197	c529b22d763bb7f70d0c6c7e1322f0a24b1543ce	typescript	0.000000	0.000000	+0.000000	+0.000000	0.000000	crash	the patch did not apply	Fuse linear reductions into exact n-ary autograd sums	
0198	a3938fdc58b0d12ac5bf6b71b1600ee275915d4b	typescript	0.000000	0.000000	+0.000000	+0.000000	0.000000	crash	the patch did not apply	Cut redundant tape nodes identity hashing and repeated optimizer work from the hot loop	
0199	a0a2d590585ae45a546555a6875ab779e54032bd	typescript	0.000000	0.000000	+0.000000	+0.000000	0.000000	crash	tsc --noEmit failed	Fuse RMSNorm onto the autograd tape with one shared exact mean-square node	
0200	3a6328d2dd17644776ed495d0c50cc0f3015fba3	typescript	0.000000	0.000000	+0.000000	+0.000000	0.000000	crash	tsc --noEmit failed	Fuse hot reductions into exact nary autograd sums	
0201	99f2d4d09fc823299a48515de543df50e7928db2	typescript	0.000000	0.000000	+0.000000	+0.000000	0.000000	crash	tsc --noEmit failed	Differentiate RMSNorm through its mean square and fuse linear and softmax sums into exact n-ary Value nodes	
0202	265963e5822873bada2cd2bf918dc87040e2c109	typescript	0.000000	0.000000	+0.000000	+0.000000	0.000000	crash	tsc --noEmit failed	Replace Set topo visitation with per-Value epochs and compute Adam bias corrections once per step	
0203	587f8815321e78b341ab8de2bb58419c57848e1a	typescript	0.000000	0.000000	+0.000000	+0.000000	0.000000	crash	tsc --noEmit failed	Restore differentiable RMSNorm normalization statistics	
0204	0785e4d2303c7cf7268a68c71e70485cd3f5ba50	typescript	0.000000	0.000000	+0.000000	+0.000000	0.000000	crash	tsc --noEmit failed	Restore differentiable RMSNorm mean-square scaling	
0205	f95237329717f6540733f8750f4e1484a1ca01c6	typescript	0.000000	0.000000	+0.000000	+0.000000	0.000000	crash	tsc --noEmit failed	Make RMSNorm mean-square scaling differentiable with one fused exact reduction	
0206	9f581aaea8ff9abc95085688700e8d24673e2d93	typescript	0.000000	0.000000	+0.000000	+0.000000	0.000000	crash	tsc --noEmit failed	Fuse differentiable RMSNorm mean and scale into two shared tape nodes	
0207	7ad58b7e77eeab7d8b2c7b3535b7fb838332a6f0	typescript	0.000000	0.000000	+0.000000	+0.000000	0.000000	crash	tsc --noEmit failed	Fuse sum reductions into one n-ary autograd node	
0208	d3f62b586cead55ce1afe0a96567f4c29179c752	typescript	0.000000	0.000000	+0.000000	+0.000000	0.000000	crash	tsc --noEmit failed	Fuse sum reductions into one n-ary autograd node to cut allocation and traversal overhead	
0209	d49474809cb0f1fe69d4d3f77305f73c835efd32	typescript	0.000000	0.000000	+0.000000	+0.000000	0.000000	crash	the response contained no fenced code block, so there is no patch to apply.	the model returned nothing usable	
0210	7fcee3cde775c98d65a0961462db7794bbeb0474	typescript	0.000000	0.000000	+0.000000	+0.000000	0.000000	crash	tsc --noEmit failed	Fuse hot linear and attention reductions into ordered exact n-ary sum nodes	
0211	22bcf1651c32d43f749d2968cf4e8bd8e39ed89c	typescript	0.000000	0.000000	+0.000000	+0.000000	0.000000	crash	tsc --noEmit failed	Make RMSNorm statistics and scaling differentiable using the existing Value tape	
0212	2cd6a50d76fc279e4e282e31b004d3bc108aa9c2	typescript	0.000000	0.000000	+0.000000	+0.000000	0.000000	crash	tsc --noEmit failed	Fuse hot fixed-scalar operations into unary autograd nodes for an unchanged loss curve	
0213	70809b6c59a647877781f1de664bee23f5c3aa48	typescript	0.000000	0.000000	+0.000000	+0.000000	0.000000	crash	tsc --noEmit failed	Restore differentiable RMSNorm mean-square scaling	
0214	225cefc6f710ad1e26cdee2ddf19f024c7c7b795	typescript	0.000000	0.000000	+0.000000	+0.000000	0.000000	crash	the response contained no fenced code block, so there is no patch to apply.	the model returned nothing usable	
0215	bdd702d2fb19e2d8e02a08fb77f65ed7d2ca96e6	typescript	0.000000	0.000000	+0.000000	+0.000000	0.000000	crash	tsc --noEmit failed	Fuse linear and attention reductions into exact nary Value nodes	
0216	d75dc24bca71206244e807bbe2c48379adcd8259	typescript	0.000000	0.000000	+0.000000	+0.000000	0.000000	crash	tsc --noEmit failed	Fuse each RMSNorm scale into one exact shared n-ary Value node	
0217	224d4c1c7915b69f0ad6df82a7638bd8feac3614	typescript	0.000000	0.000000	+0.000000	+0.000000	0.000000	crash	the response contained no fenced code block, so there is no patch to apply.	the model returned nothing usable	
0218	2386706742a751edc157812b7fb3ab8b19b98e7e	typescript	0.000000	0.000000	+0.000000	+0.000000	0.000000	crash	tsc --noEmit failed	Make RMSNorm mean square and reciprocal scale differentiable	
0219	b306f3ff7b82f6770f0794174be42b5523069739	typescript	0.000000	0.000000	+0.000000	+0.000000	0.000000	crash	tsc --noEmit failed	Restore differentiable RMSNorm mean-square and reciprocal scaling	
0220	e8bd797d9bf5e6a37f93addebf200e6848efb1a3	typescript	0.000000	0.000000	+0.000000	+0.000000	0.000000	crash	tsc --noEmit failed	Make RMSNorm mean-square and reciprocal scale differentiable with existing Value operations	
0221	f57777c5b97311380450816b1fc9384f3e78133b	typescript	0.000000	0.000000	+0.000000	+0.000000	0.000000	crash	tsc --noEmit failed	Cut autograd allocation and traversal overhead plus redundant Adam power calculations with an unchanged loss curve	
